<?xml version="1.0"?>
<!-- xmlns="http://www.imperofiere.com" xs:schemaLocation="http://www.imperofiere.com utenti.xsd" -->
<utenti xmlns:xs="http://www.w3.org/2001/XMLSchema-instance" xs:noNamespaceSchemaLocation="utenti.xsd">
	<utente>
		<nickname>admin</nickname>
		<password>d82494f05d6917ba02f7aaa29689ccb444bb73f20380876cb05d1f37537b7892</password>
		<nome>admin</nome>
		<cognome>admin</cognome>
		<datanascita>1970-01-01</datanascita>
		<indirizzo>
			<via>admin</via>
			<numero>42</numero>
			<citta>admin</citta>
			<provincia>PD</provincia>
			<CAP>42042</CAP>
		</indirizzo>
		<email>admin@admin.it</email>
	</utente>
	<utente>
		<nickname>darktal91</nickname>
		<password>5205e90469a95a4d150b72f2ba5050de40a0a9541d8977c1e571ce5244ebbec4</password>
		<nome>andrea</nome>
		<cognome>cardin</cognome>
		<datanascita>1991-11-14</datanascita>
		<indirizzo>
			<via>ghiacciaia</via>
			<numero>20/2</numero>
			<citta>santa giustina in colle</citta>
			<provincia>PD</provincia>
			<CAP>35010</CAP>
		</indirizzo>
		<email>darktal91@gmail.com</email>
	</utente>
</utenti>
